{
  "$schema":"https://json-schema.org/draft/2020-12/schema",
  "$id":"https://rules-residue.invalid/schemas/story-construction/visual-order-v2.schema.json",
  "title":"Synthetic M0 Grok Visual Order v2",
  "type":"object","additionalProperties":false,
  "required":["schema_version","order_id","order_authority","task_type","namespace_prefix","canon","release_eligible","promotion_allowed","disposition","synthetic_fixture_id","raw_request","context_manifest_ref","context_manifest_sha256","omission_report_ref","omission_report_sha256","intensity_contract_id","intensity_contract_revision","semantic_composition_proof","canon_refs","dossier_refs","must_objects","forbidden_objects","spatial_relations","salience","occlusion","state_continuity","reveal_refs","accessibility_equivalent","rights_provenance","capability_declaration","proposed_fact_classes","creates_authority","provider_profile_ref","provider_execution_authorized","order_hash"],
  "properties":{
    "schema_version":{"const":"2.0.0"},"order_id":{"type":"string","pattern":"^VISUAL-ORDER-TEST-[A-Z0-9-]+$"},"order_authority":{"const":"VALIDATED_VISUAL_ORDER_PACKAGE"},"task_type":{"const":"art"},
    "namespace_prefix":{"const":"TEST-"},"canon":{"const":false},"release_eligible":{"const":false},"promotion_allowed":{"const":false},"disposition":{"const":"TEST_EVIDENCE_ONLY"},"synthetic_fixture_id":{"const":"TEST-SCG-M0-FIXTURE-001"},"raw_request":{"const":false},
    "context_manifest_ref":{"type":"string","minLength":1},"context_manifest_sha256":{"type":"string","pattern":"^[0-9a-f]{64}$"},"omission_report_ref":{"type":"string","minLength":1},"omission_report_sha256":{"type":"string","pattern":"^[0-9a-f]{64}$"},"intensity_contract_id":{"type":"string","pattern":"^TEST-[A-Z0-9-]+$"},"intensity_contract_revision":{"type":"integer","minimum":1},
    "semantic_composition_proof":{"type":"string","minLength":1},"canon_refs":{"type":"array","minItems":1,"uniqueItems":true,"items":{"type":"string","pattern":"^TEST-[A-Z0-9-]+$"}},"dossier_refs":{"type":"array","minItems":1,"uniqueItems":true,"items":{"type":"string","pattern":"^TEST-[A-Z0-9-]+$"}},
    "must_objects":{"type":"array","minItems":1,"uniqueItems":true,"items":{"type":"string","minLength":1}},"forbidden_objects":{"type":"array","minItems":1,"uniqueItems":true,"items":{"type":"string","minLength":1}},"spatial_relations":{"type":"array","minItems":1,"uniqueItems":true,"items":{"type":"string","minLength":1}},"salience":{"type":"array","minItems":1,"uniqueItems":true,"items":{"type":"string","minLength":1}},"occlusion":{"type":"array","minItems":1,"uniqueItems":true,"items":{"type":"string","minLength":1}},"state_continuity":{"type":"array","minItems":1,"uniqueItems":true,"items":{"type":"string","minLength":1}},"reveal_refs":{"type":"array","minItems":1,"uniqueItems":true,"items":{"type":"string","pattern":"^TEST-[A-Z0-9-]+$"}},
    "accessibility_equivalent":{"type":"string","minLength":1},"rights_provenance":{"type":"array","minItems":1,"uniqueItems":true,"items":{"type":"string","minLength":1}},"capability_declaration":{"type":"array","minItems":1,"uniqueItems":true,"items":{"type":"string","minLength":1}},"proposed_fact_classes":{"type":"array","maxItems":0,"items":{"type":"string"}},"creates_authority":{"const":false},
    "provider_profile_ref":{"const":"TEST-XAI-GROK-CLI-PRECONTENT-M0-R1"},"provider_execution_authorized":{"const":false},"order_hash":{"type":"string","pattern":"^[0-9a-f]{64}$"}
  }
}
